{
  "$schema": "http://json-schema.org/draft-07/schema#",
  "$id": "review-verdict.schema.json",
  "title": "Build-review verdict record",
  "description": "One build review of one phase (REQ-030 R05, PLAN-047 D4): one file under docs/08-governance/reviews/verdicts/, named <verdict_id>.json. The coordinator writes it from the reviewer's reply without changing a finding and hands it to the builder, who commits it unchanged on the phase branch. Every field except outcomes is fixed once committed; outcomes are appended later, oldest first, as GOV-018 records append dispositions. The re-review sampler's draw record, one file per draw under docs/08-governance/reviews/draws/, is definitions/draw below.",
  "type": "object",
  "required": ["verdict_id", "date", "phase", "reviewed_commit", "reviewer", "model", "verdict", "gating", "findings", "raw_reply_sha256", "outcomes"],
  "additionalProperties": false,
  "properties": {
    "verdict_id": {
      "$ref": "#/definitions/verdict_id",
      "description": "The file's name without .json: the review date, the phase id, then the reviewer type, for example 2026-10-02-phase-asr-03-demo-adversary. A second review of the same phase by the same type on the same day adds a counter: ...-demo-adversary-2."
    },
    "date": {"$ref": "#/definitions/date"},
    "phase": {"$ref": "#/definitions/phase_id"},
    "reviewed_commit": {
      "type": "string",
      "pattern": "^[0-9a-f]{40}$",
      "description": "The full commit the review judged: the commit the command runner (tools/run_review_checks.py) ran at."
    },
    "reviewer": {
      "type": "object",
      "required": ["type", "definition_sha256"],
      "additionalProperties": false,
      "properties": {
        "type": {
          "$ref": "#/definitions/reviewer_type"
        },
        "definition_sha256": {
          "$ref": "#/definitions/sha256",
          "description": "sha256 of the agent definition file (.claude/agents/<type>.md) the reviewer was dispatched with, so a later change to the definition is visible against the verdicts it produced."
        }
      }
    },
    "model": {
      "type": "string",
      "minLength": 1,
      "description": "The model the reviewer ran on, as the dispatch reported it. Required: recording it is the precondition for cross-model review (REQ-030, What each requirement is not)."
    },
    "verdict": {
      "$ref": "#/definitions/verdict",
      "description": "pass=the reviewer found the phase may merge, with or without findings | reject=it found the phase may not merge as it stands."
    },
    "gating": {
      "type": "boolean",
      "description": "true=this verdict decided the merge | false=it ran in shadow and decided nothing (REQ-030 R06). A sampled re-review is recorded with false: the merge it would have decided has already happened."
    },
    "findings": {
      "type": "array",
      "items": {"$ref": "#/definitions/finding"},
      "description": "Every finding in the reviewer's reply, as the reviewer wrote it. Empty when it found nothing."
    },
    "raw_reply_sha256": {
      "$ref": "#/definitions/sha256",
      "description": "sha256 of the reviewer's raw reply, which the coordinator keeps as an evidence file (PLAN-047 D4)."
    },
    "outcomes": {
      "type": "array",
      "items": {"$ref": "#/definitions/outcome"},
      "description": "What was learned about the verdict afterwards, oldest first. Empty when the record is written; entries are only ever appended."
    },
    "notes": {
      "type": "string",
      "minLength": 1,
      "description": "Anything a reader needs about how this review was run. Optional."
    }
  },
  "definitions": {
    "date": {
      "type": "string",
      "format": "date",
      "pattern": "^[0-9]{4}-[0-9]{2}-[0-9]{2}$"
    },
    "verdict_id": {
      "type": "string",
      "pattern": "^[0-9]{4}-[0-9]{2}-[0-9]{2}-phase-[a-z0-9]+-[0-9]+-[a-z0-9]+(-[a-z0-9]+)*$"
    },
    "phase_id": {
      "type": "string",
      "pattern": "^phase-[a-z0-9]+-[0-9]+$"
    },
    "reviewer_type": {
      "type": "string",
      "pattern": "^[a-z0-9]+(-[a-z0-9]+)*$",
      "description": "The dedicated reviewer's agent type, for example demo-adversary or review-judge."
    },
    "sha256": {
      "type": "string",
      "pattern": "^[0-9a-f]{64}$"
    },
    "verdict": {
      "type": "string",
      "enum": ["pass", "reject"]
    },
    "finding": {
      "type": "object",
      "required": ["id", "severity", "title", "evidence"],
      "additionalProperties": false,
      "properties": {
        "id": {
          "type": "string",
          "pattern": "^F[0-9]{2,}$",
          "description": "The finding's id, unique within its record: F01, F02 and so on."
        },
        "severity": {
          "type": "string",
          "enum": ["blocker", "major", "minor"]
        },
        "title": {
          "type": "string",
          "minLength": 1,
          "description": "One sentence stating the defect."
        },
        "evidence": {
          "type": "string",
          "minLength": 1,
          "description": "What the reviewer checked to establish the defect: an evidence file from the runner's manifest, or a file and line quoted."
        },
        "consequence": {
          "type": "string",
          "minLength": 1,
          "description": "What goes wrong if the defect stands, as the reviewer stated it. Optional, because not every reviewer type states one; when the reply has it, it is recorded here unchanged, as in the plan reviews' findings (schemas/adversarial-finding.schema.json)."
        },
        "condition": {
          "type": "string",
          "minLength": 1,
          "description": "The scope, acceptance or verification entry the finding is about, quoted. Optional."
        },
        "minimal_fix": {
          "type": "string",
          "minLength": 1,
          "description": "The smallest change that would resolve the finding, named rather than written. Optional."
        }
      }
    },
    "outcome": {
      "type": "object",
      "required": ["kind", "date", "recorded_by", "detail"],
      "additionalProperties": false,
      "properties": {
        "kind": {
          "type": "string",
          "enum": ["owner-overturned", "defect-found-on-dev", "sampled-rereview"],
          "description": "owner-overturned=the owner decided against the verdict at G4 or G5 | defect-found-on-dev=a defect this review passed was later found on dev | sampled-rereview=the sampler drew the phase and another reviewer type re-reviewed it (REQ-030 R07)."
        },
        "date": {"$ref": "#/definitions/date"},
        "recorded_by": {
          "type": "string",
          "minLength": 1,
          "description": "Who appended the outcome: an agent id or repository-owner."
        },
        "detail": {
          "type": "string",
          "minLength": 1,
          "description": "What happened: the owner's words, the defect and where it was found, or the re-review's result in one sentence."
        },
        "draw_id": {
          "type": "string",
          "pattern": "^[0-9]{4}-[0-9]{2}-[0-9]{2}-[0-9]{2}$",
          "description": "The draw that sampled the phase. Required for sampled-rereview."
        },
        "reviewer_type": {
          "$ref": "#/definitions/reviewer_type",
          "description": "The type that did the re-review. Required for sampled-rereview; never a type the draw excluded."
        },
        "verdict": {
          "$ref": "#/definitions/verdict",
          "description": "The re-review's verdict. Required for sampled-rereview."
        },
        "verdict_id": {
          "$ref": "#/definitions/verdict_id",
          "description": "The re-review's own verdict record, when one was written. Optional."
        }
      },
      "allOf": [
        {
          "if": {"properties": {"kind": {"const": "sampled-rereview"}}},
          "then": {"required": ["draw_id", "reviewer_type", "verdict"]},
          "else": {
            "not": {
              "anyOf": [
                {"required": ["draw_id"]},
                {"required": ["reviewer_type"]},
                {"required": ["verdict"]},
                {"required": ["verdict_id"]}
              ]
            }
          }
        }
      ]
    },
    "draw": {
      "title": "Re-review draw record",
      "description": "One run of tools/draw_rereview_sample.py (REQ-030 R07, PLAN-047 D6): one file under docs/08-governance/reviews/draws/, named <draw_id>.json. Lists every gating verdict the draw considered, so the next draw starts after them, and the seed, so anyone can re-run the draw and get the same sample.",
      "type": "object",
      "required": ["draw_id", "date", "seed", "rate", "considered", "sample"],
      "additionalProperties": false,
      "properties": {
        "draw_id": {
          "type": "string",
          "pattern": "^[0-9]{4}-[0-9]{2}-[0-9]{2}-[0-9]{2}$",
          "description": "The file's name without .json: the draw date and a two-digit counter for that date, from 01."
        },
        "date": {"$ref": "#/definitions/date"},
        "seed": {
          "type": "integer",
          "minimum": 0,
          "description": "The seed the one-in-ten draw used."
        },
        "rate": {
          "type": "integer",
          "const": 10,
          "description": "One in this many passed gating reviews is drawn, rounded up."
        },
        "considered": {
          "type": "array",
          "minItems": 1,
          "uniqueItems": true,
          "items": {"$ref": "#/definitions/verdict_id"},
          "description": "The verdict_id of every gating verdict this draw read, sorted. No later draw reads them again."
        },
        "sample": {
          "type": "array",
          "items": {
            "type": "object",
            "required": ["phase", "verdict_id", "reason", "excluded_reviewer_types"],
            "additionalProperties": false,
            "properties": {
              "phase": {"$ref": "#/definitions/phase_id"},
              "verdict_id": {
                "$ref": "#/definitions/verdict_id",
                "description": "The passing gating verdict that was drawn; the re-review's outcome is appended to this record."
              },
              "reason": {
                "type": "string",
                "enum": ["one-in-ten", "rejected-before-pass"],
                "description": "one-in-ten=drawn by the seed | rejected-before-pass=a gating review rejected the phase before one passed it, so it is always drawn."
              },
              "excluded_reviewer_types": {
                "type": "array",
                "minItems": 1,
                "uniqueItems": true,
                "items": {"$ref": "#/definitions/reviewer_type"},
                "description": "Every reviewer type with a verdict record for the phase, gating or shadow. None of them may re-review it."
              }
            }
          }
        }
      }
    }
  }
}
