{
  "verdict_id": "2026-10-09-phase-idg-12-review-judge-3",
  "date": "2026-10-09",
  "phase": "phase-idg-12",
  "reviewed_commit": "303f00a6dc4cb42b0ac5b91a76e301dd62b52dad",
  "model": "sonnet (agent definition default; claude-sonnet family)",
  "outcomes": [],
  "reviewer": {
    "type": "review-judge",
    "definition_sha256": "6936af43c576f0339deff59f32c2d8c2469ecaa949eaf01bb316ada2f2a7ae44"
  },
  "verdict": "pass",
  "gating": false,
  "findings": [],
  "raw_reply_sha256": "8b853451ec38ab1c1e25ecfb4f1dcd580d15f2d8b0ef523309bc1a0af7094265",
  "notes": "Round 10 shadow review, dispatched by the Session Manager after the runner finished, with the phase entry, the round diff, the full diff and the runner manifest. No checkout. Raw reply at _working/session-manager/review-replies/phase-idg-12-303f00a6-review-judge.md."
}
