{
  "verdict_id": "2026-10-06-phase-idg-12-review-judge-6",
  "date": "2026-10-06",
  "phase": "phase-idg-12",
  "reviewed_commit": "41dbfbb8f1aba59fd826be59475126c3ea8371ef",
  "reviewer": {
    "type": "review-judge",
    "definition_sha256": "6936af43c576f0339deff59f32c2d8c2469ecaa949eaf01bb316ada2f2a7ae44"
  },
  "model": "sonnet (agent definition default; claude-sonnet family)",
  "verdict": "pass",
  "gating": false,
  "findings": [
    {
      "id": "F01",
      "severity": "minor",
      "title": "The command text says \"run this exact command verbatim\" yet still requires the agent to hand-fill depends_on=[...]/documents={...} before running — not fully constant as claimed.",
      "evidence": "test/test_planner_safe_write.py:536 / agent-workflows/idea-planner-agent.md.",
      "consequence": "Pre-existing design; the inputs are the planner's own pairing decision, not draft-derived text, so not the round-6 hazard reopened — documentation precision only."
    }
  ],
  "raw_reply_sha256": "50dec9cf6766a780a1183ca68c87e49c10e2ed42b97b8b62fa634f72f0096bf5",
  "outcomes": [],
  "notes": "Round 7, a short re-review of one fix under the owner's 2026-10-06 ruling to give the planner the Write tool and remove all variable text from the check command. Dispatched and briefed by the Session Manager after the runner finished. Brief: the round-6 blocker and the missing-Write-tool observation, the owner's ruling, the checks to make, the fix delta a9038976 -> 41dbfbb8 as a file path (docs/03-sessions excluded), and the runner manifest _working/review-checks/phase-idg-12/41dbfbb8f1ab/ (8 entries, passed). Raw reply kept at _working/session-manager/review-replies/phase-idg-12-41dbfbb8-review-judge.md. No checkout (shadow judge)."
}
