{
  "verdict_id": "2026-10-06-phase-idg-12-review-judge-3",
  "date": "2026-10-06",
  "phase": "phase-idg-12",
  "reviewed_commit": "4be47bdbce5183f4353c125df48c19fb43bce9ad",
  "reviewer": {
    "type": "review-judge",
    "definition_sha256": "6936af43c576f0339deff59f32c2d8c2469ecaa949eaf01bb316ada2f2a7ae44"
  },
  "model": "sonnet (agent definition default; claude-sonnet family)",
  "verdict": "pass",
  "gating": false,
  "findings": [
    {
      "id": "F01",
      "severity": "minor",
      "title": "Double-quoting the placeholder does not make the command safe against a slug/path containing \", $ or backticks; no test covers these.",
      "evidence": ".claude/agents/idea-planner.md:9-10 and agent-workflows/idea-planner-agent.md:24-25 (as the reviewer cited them). $/backtick content is live shell syntax inside double quotes (command substitution risk); an embedded \" breaks the quoting outright.",
      "consequence": "Not a blocker for the round-3 finding as scoped (space/apostrophe), but a residual gap if the owner wants the command hardened against arbitrary slug content."
    }
  ],
  "raw_reply_sha256": "b9b43da3834ad929ff11c991e5805fcf50db49a945e11961553c20efea521564",
  "outcomes": [],
  "notes": "Round 4, a short re-review of one fix under the owner's 2026-10-06 ruling to fix round 3's unquoted-path finding (an earlier acceptance, relayed on the SM's wrong claim that paths never contain spaces, was withdrawn). Dispatched and briefed by the Session Manager after the runner finished. Brief: the finding, the owner's ruling, the hazards to try (space, apostrophe, double quote, $, backtick, leading dash, unicode), the fix delta 4be47bdb~1 -> 4be47bdb as a file path (docs/03-sessions excluded), and the runner manifest _working/review-checks/phase-idg-12/4be47bdbce51/ (8 entries, passed). Raw reply kept at _working/session-manager/review-replies/phase-idg-12-4be47bdb-review-judge.md. No checkout (shadow judge)."
}
